{
  "$schema": "https://json-schema.org/draft/2020-12/schema",
  "type": "object",
  "additionalProperties": false,
  "required": ["run_summary", "helpful_prior_work", "always_on_candidates", "demotions", "searchable_additions", "quarantines", "withholding_rules"],
  "properties": {
    "run_summary": {"type": "string"},
    "helpful_prior_work": {"type": "array", "items": {"type": "string"}},
    "always_on_candidates": {"type": "array", "items": {"type": "string"}},
    "demotions": {"type": "array", "items": {"type": "string"}},
    "searchable_additions": {"type": "array", "items": {"type": "string"}},
    "quarantines": {"type": "array", "items": {"type": "string"}},
    "withholding_rules": {"type": "array", "items": {"type": "string"}}
  }
}

